{
  "title": "Saddle",
  "kind": "surface",
  "colorMap": "coolWarm",
  "showGrid": false,
  "surface": {
    "x": { "min": -1, "max": 1 },
    "y": { "min": -2, "max": 2 },
    "z": [
      [2, 1, 0, 1, 2],
      [1, 0.5, 0, 0.5, 1],
      [0, 0, null, 0, 0],
      [1, 0.5, 0, 0.5, 1],
      [2, 1, 0, 1, 2]
    ]
  }
}
